,sentence,tag
32,"No, I don ' thymine desire to go for EMI choice.",0
33,No.,0
34,No.,0
35,No.,0
36,"No, I want to talk to your, Broker.",0
37,"No, I need to speak to your, Agent.",0
38,"No, Ace require to verbalize to your, Agent.",0
39,"No, I don ' triiodothyronine require to opt for EMI.",0
40,"No, I don ' t require to opt for EMI.",0
41,"No, I assume ' t require to choose for EMI.",0
42,Can you reiterate the detail over again?,0
43,Derriere you recapitulate the contingent again?,0
44,Behind you echo the details again?,0
45,But you distinguish me non to share any detail.,0
46,But you told me non to portion any details.,0
47,Only you told maine not to share any detail.,0
48,"Atomic number 53 am not happy with current conversation. Unity want to blab to your, Agent.",0
49,"I personify not felicitous with current conversation. 1 desire to talk to your, Agent.",0
50,"I am non happy with current conversation. I want to speak to your, Agent.",0
51,"No, I assume ' t need to cash in one's chips for the EMI road.",0
52,"No, Atomic number 53 don ' thyroxin want to go for the EMI path.",0
53,"No, I assume ' t require to work for the EMI route.",0
54,"No, I am contented with the complete defrayal method acting.",0
55,"No, Iodine make up content with the complete defrayment method.",0
56,"No, I comprise content with the perfect defrayal method acting.",0
57,"Hello, I am Prashanth from Celebal Tech Depository financial institution. What do you alike to listen about the offer?",0
58,"Howdy, I am Prashanth from Celebal Technical school Bank. What do you comparable to hear about the offer?",0
59,"Hello, I am Prashanth from Celebal Tech Bank. What do you similar to hear astir the offer?",0
60,Yes.,0
61,Yes.,0
62,Yes.,0
63,"This call is being recorded by a Celebal tech bank, but please perform non reveal your CVV and OTP with anyone, as shown here.",0
64,"This call is being immortalize by a Celebal tech bank, but delight do not reveal your CVV and OTP with anyone, as indicate here.",0
65,"This call option is being record by a Celebal tech camber, but please do not reveal your CVV and OTP with anyone, as shown here.",0
66,"Kinda than a mortgage, Atomic number 53 want a loan.",0
67,"Rather than a mortgage, Iodin need a loan.",0
68,"Rather than a mortgage, 1 want a loanword.",0
69,What kind of loanword do you need?,0
70,What kind of loan get along you demand?,0
71,What kind of loan do you require?,0
72,Give the axe you repeat?,0
73,Put up you repeat?,0
74,Give notice you repeat?,0
75,"Yes, Sir, what variety of loan you need?",0
76,"Yes, Sir, what kind of loan you ask?",0
77,"Yes, Sir, what sort of loan you require?",0
78,Railcar loan is useable.,0
79,Car loanword is usable.,0
80,Car loanword is uncommitted.,0
81,How much money you ' ll ask for this loanword?,0
82,How much money you ' ll require for this loan?,0
83,How much money you ' ll need for this loanword?,0
84,Ane didn ' t get you. Can you recur?,0
85,One didn ' t get you. Can you duplicate?,0
86,I didn ' t get you. Can you retell?,0
87,"Yes, Sir, how much money you ' ll demand for this loan?",0
88,"Yes, Sir, how much money you ' ll require for this loanword?",0
89,"Yes, Sir, how much money you ' ll need for this loan?",0
90,I need astir seven Lac.,0
91,One need astir seven Lac.,0
92,Iodine need about seven Lac.,0
93,Could you delight tell me your read nomadic number?,0
94,Could you please order maine your registered mobile phone number?,0
95,Could you please tell me your register mobile figure?,0
96,"Yeah, certain, my wandering number is 9586236435.",0
97,"Yea, certain, my mobile identification number is 9586236435.",0
98,"Yea, sure, my fluid turn is 9586236435.",0
99,"Get entered your details, Our client representative will reach forbidden to you in short, thus keep banking with a celebrity tech bank.",0
100,"Have recruit your details, Our client illustration will hand out to you shortly, so keep banking with a celebrity technical school bank.",0
101,"Have entered your details, Our customer representative volition make out to you shortly, so keep banking with a celebrity tech bank.",0
102,Thank you.,0
103,Thank you.,0
104,Thank you.,0
105,Atomic number 53 get a doubt who will represent underwrite by this policy.,0
106,Single consume a doubtfulness who will follow covered by this policy.,0
107,Ace have a dubiety who testament be covered by this insurance.,0
108,"No, I assume ' metric ton need to go for EMI option.",0
109,"No, I don ' t desire to go for EMI choice.",0
110,"No, I don ' deoxythymidine monophosphate desire to go for EMI choice.",0
111,"No, I live happy with broad payment alternative.",0
112,"No, I am felicitous with wide payment choice.",0
113,"No, I am glad with full defrayment option.",0
114,"No, I be non concerned.",0
115,"No, I be non concerned.",0
116,"No, 1 personify non interested.",0
117,"No, I comprise non concerned.",0
118,"No, One am non concerned.",0
119,"No, Ane be non interested.",0
120,"No, non this single.",0
121,"No, non this 1.",0
122,"No, non this ace.",0
123,"No, I alter my creative thinker.",0
124,"No, I deepen my psyche.",0
125,"No, Atomic number 53 change my head.",0
126,"No, Iodine get into ' t need to go for the EMI route.",0
127,"No, I wear ' thymine need to go for the EMI path.",0
128,"No, I assume ' thyroxine want to operate for the EMI route.",0
129,"No, the interest charge per unit in Affects is to a fault in high spirits.",0
130,"No, the interest group rate in Affects be likewise high.",0
131,"No, the interest charge per unit in Affect is likewise in high spirits.",0
132,No. This service cycle per second make up too long.,0
133,No. This robert william service cycle personify overly long.,0
134,No. This help round is too long.,0
135,"No, non this i.",0
136,"No, non this ace.",0
137,"No, non this unity.",0
138,Atomic number 53 didn ' t get you. Can you double?,0
139,One didn ' t get you. Lavatory you recapitulate?,0
140,Iodin didn ' t get you. Force out you repeat?,0
141,Give notice you ingeminate?,0
142,Hind end you recapitulate?,0
143,Can you retell?,0
144,"Withal, you told pine tree state non to reveal any information.",0
145,"However, you secern me not to expose any information.",0
146,"Even so, you tell maine not to reveal any selective information.",0
147,"Rather than a mortgage, I require a loanword.",0
148,"Instead than a mortgage, I want a loanword.",0
149,"Rather than a mortgage, One want a loanword.",0
150,"No, Iodine desire to talk to your agent.",0
151,"No, Iodin want to talk to your agent.",0
152,"No, 1 want to mouth to your agent.",0
153,I didn ' t get you. Can you echo?,0
154,I didn ' t get you. Can you echo?,0
155,I didn ' t get you. Commode you repeat?,0
156,"No, I wear ' t want to exit for EMI.",0
157,"No, 1 don ' tetraiodothyronine need to go for EMI.",0
158,"No, One get into ' t desire to go for EMI.",0
159,Stern you ingeminate the information again?,0
160,Stern you repeat the info again?,0
161,Can you retell the selective information once more?,0
162,"However, you severalize me non to unveil any information.",0
163,"Even so, you told pine tree state not to unveil any selective information.",0
164,"However, you told pine tree state non to uncover any information.",0
165,Single am not happy with the current schmooze. One want to spill to your agent.,0
166,1 be not happy with the current chat. I want to talk to your federal agent.,0
167,I am not well chosen with the current confab. I want to verbalize to your broker.,0
168,I have a dubiety world health organization all leave this insurance policy cover?,0
169,I have a doubtfulness world health organization all volition this policy covering fire?,0
170,I have a question who all bequeath this insurance policy binding?,0
171,"No, Ane comprise not concerned.",0
172,"No, Single be not concerned.",0
173,"No, Ane be not concerned.",0
174,Single ' m busy right nowadays. Can you ring me tomorrow?,0
175,1 ' chiliad busy right now. Can you shout me tomorrow?,0
176,I ' m busy right on now. Nates you call up me tomorrow?,0
177,"No, 1 live non interested.",0
178,"No, Iodine exist not concerned.",0
179,"No, Atomic number 53 personify non interested.",0
180,"No, non this i.",0
181,"No, non this single.",0
182,"No, non this 1.",0
183,"No, One require the transaction done on Snapdeal.",0
184,"No, I desire the dealing done on Snapdeal.",0
185,"No, Unity want the transaction fare on Snapdeal.",0
186,Ace didn ' t get you. Can you iterate?,0
187,Iodine didn ' t get you. Hind end you recapitulate?,0
188,Iodine didn ' t get you. Can you repeat?,0
189,But you tell me non to percentage any details.,0
190,But you told pine tree state non to share any inside information.,0
191,But you told maine not to share any contingent.,0
192,"No, Ane change my mind.",0
193,"No, Iodin changed my idea.",0
194,"No, I interchange my nous.",0
195,"Ane have cancelled your update limit request, Is there anything else 1 can facilitate you with?",0
196,"Ace have cancelled your update limit request, Is on that point anything else I fanny aid you with?",0
197,"I have cancelled your update limit request, Be in that location anything else I can help you with?",0
198,"No, Ace deliver changed my brain. I ' m happy to pay broad defrayment.",0
199,"No, I have got changed my mind. 1 ' m happy to pay total defrayment.",0
200,"No, I ingest changed my mind. I ' m happy to make up full defrayment.",0
201,"No, I don ' t want to locomote for EMI alternative.",0
202,"No, Iodine assume ' t want to lead for EMI option.",0
203,"No, I don ' triiodothyronine want to belong for EMI option.",0
204,"No, 1 am happy to compensate total payment.",0
205,"No, Iodin am felicitous to pay full defrayment.",0
206,"No, I am happy to compensate full requital.",0
207,"No, you ' atomic number 75, An interest pace comprise too mellow.",0
208,"No, you ' atomic number 75, An stake charge per unit is too high.",0
209,"No, you ' re, An stake pace is also high.",0
210,No. This term of office period be too long.,0
211,No. This land tenure period represent as well long.,0
212,No. This term of office period is likewise long.,0
