,sentence,tag
321,That's no problem; we can change the tenure based on your needs. Please let me know what tenure you are looking for.,1
322,I want ten months only.,1
323,"Yes, we have just the right deal for ten months. The interest rate, Applicable, will be 14%, and the monthly EMI will be 2276, where the tenure period of ten months will be ten months.",2
324,"Yes, please continue.",2
325,"That's great, because we can share the charges and estimation of the monthly EMI. You can also pay the service tax on your first EMI, which will be included in your new bill.",2
326,My postal code is 6236980.,1
327,"Thank you for letting me know, what your current credit limit is.",1
328,My credit limit is 60000.,1
329,"Thanks for reporting the details. Your transaction will be converted into EMI within two working days,Sir, you will be sent a text message confirming your EMI number, and if you have used any reward point on this particular deal, it will be canceled. If you have used any reward point, please advise me that an individual transaction, whether you're higher or not, will be applicable, and tax will be levied.",1
330,That's no problem.,1
331,"On your card, you have unlocked a special credit card upgrade limit. We're going to increase your credit limit from 60,000 to 90,000 after your approval.",2
332,"Yes, I want the credit limit to be upgraded.",2
333,Could  you please tell me your registered mobile number?,1
334,"Yeah, sure, my mobile number is 9886564258.",1
335,"Congratulations, your credit limit has been raised. You can now spend up to 90,000 on your credit card.",2
336,Thank you.,2
337,"Hello, everyone. Celebal technologies power this IVR automation for banking.",1
338,Okay.,1
339,"I am Prashanth, a celebal tech bank. We have an EMI package that has been specially designed for you. Would you like to know more about the product?",2
340,"Yes, I want to know.",2
341,"This call is being recorded by a celebal tech bank, but please do not reveal your CVV and OTP with anyone, as shown here. Would you like to turn this into EMI?",1
342,"No, not this one.",0
343,"OK, I can also see a 25,000 transaction on,Nyka would you like to convert this into EMI.",1
344,I want the transaction to be completed on Nyka.,1
345,"That's fantastic,On Nyka, you've made a 25,000 purchase, would you like to turn this into EMI?",2
346,I didn't get you. Can you repeat?,0
347,"That's fantastic, you've made a 25,000 purchase on nyka. Would you like to turn this into EMI?",2
348,Hold on for a second.,1
349,"Yes, I will hold. Please let me know when to return.",1
350,"Yes, what  you were saying.",1
351,"Yes, I was saying that it's awesome. You've made a 25,000 on nyka deal. Would you like to turn this into EMI?",2
352,"Yes, sure.",2
353,"Sir,Could you please inform at what tenure you are interested in?",1
354,What is the tenure period?,1
355,"The tenure period is the number of months in which you pay your EMI for the transaction amount, so please tell me, the tenure period.",1
356,What will be the monthly payment for the 9-month EMI option?,1
357,"Yes, according to the nine-month tenure, the monthly sum payable would be 1,1600, which would include 12% more interest.",1
358,I want a six-month EMI option.,1
359,"Yes, let me tell you. Your first EMI installment will be 2171, with the interest rate of 12%. Also, there will be a one-time processing fee that will be included in your new bill.",1
360,What if I preclose this EMI?,1
361,"Your total transaction amount is 25,000, and the EMI will be 2171 for six months of EMI. The EMI will continue to decline every month, so I hope the details are clear.",2
362,"Yes, please proceed.",2
363,"Sir, the EMI amount will be temporarily held in your credit card limit, and when you pay your EMI, the limit will be revealed.",1
364,Can you repeat?,0
365,"Sir, thank you. The EMI amount will be temporarily held in your credit card limit, and when you pay your EMI, the limit will be revealed.",2
366,"However, you told me not to reveal any information.",0
367,"Sir, I am not asking for sensitive information. We need this information for verification purposes. So what should we do?",1
368,Yes.,2
369,Thank you. Can you tell me your credit limit?,2
370,"My credit score is 90,000.",1
371,Thanks for revealing your credit limit. Can you please help me with your postal code?,2
372,My postal code is 263139.,1
373,Thanks for revealing your postal code. Can you please help me with your date of birth?,2
374,2nd May 1975.,1
375,"Thanks for revealing your date of birth, Could  you please tell me your registered mobile number?",2
376,"Yeah, sure, my mobile number is 8562478926.",1
377,"We're all set, and you'll get an email update shortly. Thank you so much.",2
378,Thank you.,2
379,"Hello, everyone. Celebal technologies power this IVR automation for banking.",2
380,Hi.,2
381,"Hello, I am Prashanth from Celebal Tech Bank. We have an EMI offer made specifically for you. Do you want to know more about this product?",2
382,"Yes, sure.",2
383,"This call is being handled by a celebal tech bank, so please do not reveal your CVV and OTP with anyone for security reasons.",1
384,"Rather than a mortgage, I want a loan.",0
385,What kind of loan do you need?,1
386,"For my masters, I need a research loan.",1
387,How much money will you need for this loan?,1
388,I need 9 Lacs.,1
389,"I have locked your details,will we speak to you soon? Thank you.",2
390,Thank you so much.,2
391,"Hello, everyone. Celebal technologies power this IVR automation for banking.",2
392,Hi.,2
393,I am Prashanth from Celebal tech bank. We have an EMI offer made specifically for you. Do you want to know more about this product?,2
394,"Yes, sure.",2
395,"This call is being recorded by a celebal tech bank, Please do not reveal your CVV and OTP with anyone for security reasons.",1
396,I need a loan.,1
397,What kind of loan do you need?,1
398,Home loan.,1
399,How much money will you need for this loan?,1
400,"I need 25,00,000.",1
401,"I have saved your information, and our customer representative will reach out to you shortly. Thank you.",2
402,Thank you so much.,2
403,"Hello, everyone. Celebal technologies power this IVR automation for banking.",2
404,Hi.,1
405,"I am Prashanth, a celebal tech bank, and we have an EMI offer made for you. Would you like to know more about it?",1
406,"Yes, sure.",2
407,"This call is being recorded by a celebal tech bank, but please do not reveal your CVV and OTP with anyone, as I can see a transaction of 25,000 on Amazon. Would you like to turn this into EMI?",1
408,"Yes, convert this one.",2
409,"Sir, that's a good idea. Could you please specify what tenure you're interested in?",2
410,Describe the monthly EMI for a six-month tenure.,1
411,"Yes, according to the six-month tenure, the monthly amount payable would be 5432, and it would include 12% more interest.",2
412,"No, I want to talk to your agent.",0
413,"OK, please wait while we're calling our agent.",1
414,"IVR atuomation demo, I can assist with bank related problems.",1
415,I want to upgrade my online transaction limit for my credit card.,2
416,"Yes, I can help with the change on your credit card, but I can see that your new limit is set to,Two Lacs, for online transactions. You can also specify how much money you would like to set the new limit.",2
417,"I want to raise my ceiling to 2,50,000.",1
418,"Please advise that you intend to raise the ceiling for online transactions to 2,50,000.",1
419,Yes.,2
420,"Congratulations, I have raised your ceiling. You can now spend up to 2,50,000 for online transactions. Is there anything else I can help you with?",2
421,"Yes, I want to talk to your agent.",2
422,Please wait while we're calling our agent.,1
423,"Hi,I am Prashanth calling you from Celebal Tech Bank,We have an EMI offer specially created for you,What do you like to know more about the offer?",2
424,Yes.,2
425,"This call is being recorded by celebal tech Bank,For security reasons, please do not share your CVV and OTP with anyone,As I can see here,Transaction of 57,000 done on Flipkart. Would you like to convert this into EMI?",1
426,I want a loan instead.,1
427,What type of loan you required?,1
428,Can you repeat again?,1
429,"Sure, Sir,What type of loan you required?",2
430,Car loan.,1
431,How much amount you will need for this loan?,1
432,I didn't get you. Can you repeat?,0
433,"Sure, Sir,How much amount you will need for this loan?",1
434,I need about seven Lac.,1
435,"Have logged your details,Our customer representative will reach out to you soon, keep banking with celebal tech bank.",2
436,Thank you.,2
437,"I'm glad to see you on the IVR Automation demo, because I can help with bank related questions.",2
438,Hello.,2
439,"I am Prashanth, a celebal tech bank, am I talking to Mr Manoj?",1
440,"Yes, you are.",2
441,"Mr Manoj, thank you for sharing your name. This call is being monitored by a celebal tech bank for safety reasons. Please do not reveal your CVV and OTP with anyone else.",1
442,"Yes, sure.",2
443,"I can see that you have recently completed the conversion of 42,000 from Flipkart on October 16th 2021, using your credit card. You will then convert this amount into EMI.",1
444,I am able to pay with full pay.,2
445,"Sir, that's fantastic, but the EMI payment plan will save you from having to pay one time, so please allow me to recommend a great deal.",2
446,"No, I don't want to go for EMI.",0
447,"OK, so you can't block a significant amount and it won't have no effect on your monthly budget if you go for EMI.",2
448,"Yes, please proceed.",2
449,"Sir, that's fantastic, Sir, We have a customised offer for you. You can choose between 4/8 and 11 months EMI.",2
450,What is the time of a tenure?,1
451,"Sir, this is the number of months in which you pay your EMI for the transaction amount. So can you please tell me the tenure period?",1
452,"However, the monthly payment for the six-month EMI option will be deferred.",1
453,"Yes, according to the six-month contract, the monthly amount payable would be 5426, but it would include 12% more in interest income.Should I proceed?",2
454,EMI. Tell me the monthly payment for 12 months.,1
455,"Yes, according to the 12 month tenure, the monthly amount payable would be 4023, which would include 12% more interest income.",1
456,I want a four-month EMI option.,1
457,"Yes,Let me brief you, according to the four-month tenure, your first EMI installment will be 10,670 with the exception of service tax.",1
458,Is this processing fee only valid once?,1
459,"Yes, absolutely, Sir. It will only be charged once.",2
460,How much processing fee will be charged?,1
461,So what should be done after the announcement? A processing fee of 250 + 16% will be added to your first installment.,1
462,Can you repeat the information again?,0
463,"Of course, let me briefly outline your first EMI installments, which will be 10,670 with the interest rate of 12%.",1
464,"However, you told me not to reveal any information.",0
465,"Sir, I am not asking for sensitive information. We need this information for verification purposes.",1
466,"It's OK,'s fine.",2
467,Thank you. Can you tell me your credit limit?,2
468,"My credit score is 95,000.",1
469,Thank you for revealing your credit limit. Can you help me with your postal code?,2
470,My postal code is 367523.,1
471,"Thank you for sharing the information.Your order has been captured and your transaction of 42,000 will be converted into EMI within three working days, as well as a downloadable copy with EMI breakup information.",2
472,Yes.,2
473,"If you want to pre close your EMI, then on individual transaction minimum 350 or 5% will be levied on remaining amount plus tax, according to Hope I.",1
474,Yes.,2
475,"You have unlocked a special credit card upgrade, Offer on your card. We're going to increase your credit limit from 95,000 to 1,80,000 after your approval.",2
476,"Yes, I want to Upgrade.",2
477,"Congratulations, your credit limit has been raised. You can now spend up to 1,80,000 on your credit card.",2
478,I am not happy with the current chat. I want to talk to your agent.,0
479,Please wait while we are transferring this call to our agent.,1
480,Welcome to celebal Tech IVR automation demo.,1
481,"Hi, how are you?",2
482,"Hello, I'm fine. Thank you for calling CT insurance. My name is Prashanth. How can I help you today?",2
483,"I want to know,About my,Insurance policy.",1
484,"Of course I can do that,Could you please confirm a few details before I give you the necessary information,Could you please tell me your registered mobile number?",1
485,"Yes, sure. My mobile number is 9956565232.",2
486,I can confirm that you have active health insurance policy with us. Can you confirm your name and date of birth for authentication?,2
487,Sure. My name is Manoj and my date of birth is 6th June 1970.,2
488,"Thanks for confirmation. I can see that your policy is due for the renewal on 28th March 2022, which is in one week from now,You can renew either for one year or two years. The one year option is 17,000 and two year option is 26,000.",2
489,I want to opt for one year option.,2
490,Would you like me to generate a payment link of renewal for this option?,1
491,Yes.,2
492,"Sure, I will share the link with you shortly.",2
493,I have a doubt who all will this policy cover?,0
494,"Set your current policy covers you, your spouse, and your parent.",1
495,"OK, please send me the payment reminder.",1
496,Of course you will receive a payment link on your registered mobile number.,1
497,"Hi,I am Prashanth calling you from Celebal Tech Bank,We have an EMI offers specially created for you,Would you like to know more about the offer?",2
498,"No, I am not interested.",0
499,"I respect that, Sir,But by opting for an EMI, my you're not blocking huge cash, which makes your personal budgeting for the month easier,You can also get to know precisely how much money you need to pay towards the EMI each month,Would you like to know about the offer?",2
500,I'm busy right now. Can you call me tomorrow?,0
501,"Sure, Sir,Will get back to you tomorrow. Have a great day ahead. Thank you.",1
502,"Hi I am Prashant calling you from celebal tech bank,We have an EMI offer specially created for you,Would you like to know more about the offer?",2
503,"No, I am not interested.",0
504,"I respect that, Sir,But by opting for an EMI,You are not blocking huge cash which makes your personal budgeting for the month easier,You can also get to know precisely how much money you need to pay towards the EMI each month,Would you like to know about the offer?",2
505,"Yes, go on.",2
506,"This call is being recorded by celebal tech Bank,For security reasons, please do not share your CVV and OTP with anyone,As I can see a transaction of 27,000 done on myntra,Would you like to convert this into EMI?",1
507,"No, not this one.",0
508,"OK, I can also see a transaction of 32,000 done on Amazon. Would you like to convert this into EMI?",1
509,"No, I want the transaction done on Snapdeal.",0
510,"That's great,You have done a transaction of 26,500 on Snapdeal. Would you like to convert this into EMI?",2
511,"Yes, convert this one.",2
512,"That's a great choice, Sir,You can choose from the tenure period of three, seven, and eleven months,What tenure period would you be interested in?",2
513,I didn't get you. Can you repeat?,0
514,"That's a great choice, Sir. You can choose from the tenure period of three, seven and eleven months. What tenure period would you be interested in?",2
515,What is tenure period?,1
516,"Sir, that tenure period is the number of month in which you pay your EMI for the transaction amount,So can you please tell me the tenure period?",1
517, Tell me the monthly payment for seven month EMI option.,1
518,"Sure, according to the tenure period of seven months, the monthly amount payable will be 4143,It will consist of 13% plus tax on the interest amount. Should I proceed?",1
519,What will be the monthly payment for 10 month EMI option?,1
520,"Sure, according to the tenure period of 10 months, the monthly amount payable will be 2818. It will consist of 13% plus tax on the interest amount. Should I proceed?",1
521,Then I want seven month option.,2
522,"Sure. Let me brief you according to the tenure period of seven months, your first EMI installment will be 4143,With the interest rate of 13% and there is also a one time processing fee applicable which will be of 350 excluding service tax,This processing fee plus your first EMI will be included in your upcoming bill. Should I proceed?",1
523,"Yes, proceed.",2
524,"Mr Manoj, you were total transaction amount is 26,500 and the EMI will be 4143 for seven months of EMI,That, EMI,  consist of principal amount plus tax on the interest which will keep on reducing every month. I hope all the details are clear. Should I proceed?",1
525,Hold on for a second.,1
526,"Sure, I will hold. Please let me know when to continue.",1
527,"Yes, continue.",2
528,"Sure. I was saying, Mr Manoj, you are total transaction amount is 26,500 and the EMI will be 4143 for seven months of EMI,The EMI consist of principal amount plus tax on the interest which will keep on reducing every month. I hope all the details are clear. Should I proceed?",1
529,Ohk OK proceed.,2
530,"Thank you, Sir,That EMI amount will be temporary, kept on hold in your credit card limit,And when you pay your EMI, the limit will be released. Hope you are clear with this information. Please confirm few details like credit limit and date of birth.",2
531,But you told me not to share any details.,0
532,"Sir, I'm not asking for sensitive information. We need these details for verification purpose,Should I proceed?",1
533,"Yes, go on.",2
534,"Thank you,Can you tell me your credit limit?",2
535,"My credit limit is 95,000.",1
536,Thanks for confirming your credit limit. Can you please help me with your postal code?,2
537,My postal code is 42568.,1
538,Thanks for confirming your postal code. Can you please help me with your date of birth?,2
539,20 May 1960.,1
540,"We are all done,Then you will receive an email update shortly. Have a wonderful day ahead. Keep banking with celebal tech bank.",2
541,"Welcome to celebal technologies IVR Automation demo,I can help with bank related queries.",2
542,I want to update my online transaction limit for my credit card.,2
543,"Good,I can help with updating your transaction limit on your credit card,I can see your current limit is set to 30,000 for online transactions,To what amount you would like to set the new limit to.",2
544,"I want to,Update my new limit to  60,000.",1
545,"Please confirm that you want to update the limit for online transaction to 60,000.",1
546,Yes.,2
547,"Congratulations,I have updated your limit. You can now spend up to 60,000  for online transactions,Is there anything else I can help you with?",2
548,I want to upgrade the credit limit.,2
549,"Sure,I can help with updating your transaction limit on your credit card. I can see your current limit is set to 60,000 for online transactions,To what amount you would like to set the new limit too.",2
550,"I want to,Update it to 65,000.",1
551,"Please confirm that you want to update the limit for online transaction to 65,000.",1
552,"No, I changed my mind.",0
553,"I have cancelled your update limit request,Is there anything else I can help you with?",0
554,"Yes, I want to talk to an,Agent.",1
555,Please wait while we are transferring this call to our agent.,1
556,"Hi,I am Prashanth calling you from celebal Tech Bank,We have an EMI offer specially created for you. Would you like to know more about the offer?",2
557,"Yes, sure.",2
558,"This call is being recorded by celebal tech Bank for security reasons. Please do not share your CVV and OTP with anyone,As I can see a transaction of,39,000 done on Flipkart. Would you like to convert this into EMI?",1
559,"Yes, convert this one.",2
560,"That's a great choice, Sir,Could you please confirm at what tenure would be,Interested in?",1
561,Tell me the monthly payment for the tenure of six months.,1
562,"Sure,According to the tenure period of six months, the monthly amount payable will be 4714. It will consist of 12% plus tax on the interest amount,Should I proceed?",1
563,"No,I have changed my mind. I'm happy to pay full payment.",0
564,"That's great, Sir, but the EMI offer will reduce your one time payment burden, so please allow me to suggest you a great offer.",2
565,"No,I don't want to go for EMI option.",0
566,"Sir, by opting for EMI you won't block a big amount and it won't affect your monthly budget,Should I proceed?",1
567,"No,I am happy to pay full payment.",0
568,"That's great, Sir. Thank you for your valuable time. Keep banking with celebal tech bank. Thank you.",2
569,Thank you.,2
570,"Thank you for using celebal tech bank credit card, Mr Manoj,We are pleased to offer a special EMI facility on your card,So that you can convert your purchases above 2500 into easy monthly installments and enjoy paying back and easy in settlements.",2
571,"OK, go ahead.",2
572,Please allow me to share the details of this EMI offer.,1
573,"Sure. Please go,ahead.",2
574,"Thank you so much, Sir,I can see that you have recently done the transaction of 20,000 from chroma on May 31st, 2021 through your credit card,You can instantly get this amount converted into EMI,Adding an interest rate starting from 14% per annum,Would you like to convert this into EMI?",2
575,"Yes, please go ahead.",2
576,"We have customized EMI options available for you,Which will be of 2550 monthly for the tenure of nine months,The EMI monthly,Amount will consist of 16% plus tax on interest amount,Should I proceed to big book this EMI?",1
577,"No, you're,An interest rate is too high.",0
578,"No problem. We can provide a special interest rate for you,According to new offer,The interest rate will be 14% and your monthly EMI amount will be,15186 for the tenure of 16 months,Would you like to,Convert this EMI option.",2
579,No. This tenure period is too long.,0
580,"That's no issue. We can change the tenure according to your needs. Please let me know what tenure period you are looking for,The transaction amount of 20,000.",1
581,I want ten your period for 12 months only.,1
582,"Sure. We have just the best offer for 10 months tenure period,The interest rate,Applicable will be 14% and the monthly EMI will be,2276, where the tenure period of 10 months, should I proceed booking the EMI option?",2
583,"Yes, please go on.",2
584,"That's great,I believe we can share the charges and calculation of the monthly EMI,Let me once again confirm that,You would like to convert your transaction of 20,000 for 10 tenure of 10 months. The interest rate is 14% per annum and will be charged on monthly balance plus tax applicable on interest amount,There is also a one time processing fee applicable which will be 450 including service tax. This processing fee plus your first EMI will be included in your upcoming bill,Your first EMI will be,2276,Before proceeding with EMI booking option, please confirm your PIN code of your address.",1
585,6236980,1
586,Thanks for confirming your PIN code. Please let me know what's your current credit limit is.,2
587,My credit limit is 60000?,1
588,"Thanks for confirming the details. Your request has been captured,And your transaction will get converted into EMI within two working days,Sir, you will get confirmation SMS to your registered mobile number and you will get,The soft copy to your registered email address which will have the EMI breakup details,Also, let me inform you if you have availed any reward point on this particular transaction, it will be lapsed,If you want to pre close your EMI then an individual transaction,Of minimum 300 or,3% on remaining principle outstanding amount, whichever is higher,Is applicable and tax will be applicable on preclosure charges.",2
589,That's no issue.,2
590,"You have unlocked a special credit card upgrade limit offer on your card,We will be happy to increase your credit limit from 60,000 to 90,000 after your confirmation.",2
591,"Yes, I want the credit limit,Upgraded.",2
592,"Congratulations, your credit limit is upgraded. You can now spend,Up to 90,000 on your credit card. Thank you for your valuable time. Keep banking with celebal tech bank.",2
593,Thank you.,2
0,I have a question. Will this insurance track my family equally intimately?,0
1,One take a doubt. Will this insurance policy cover my family every bit advantageously?,0
2,One have a doubt. Testament this insurance policy encompass my family as intimately?,0
3,"No, non this unity.",0
4,"No, non this i.",0
5,"No, non this 1.",0
6,I didn ' t get you. Rear you repeat?,0
7,1 didn ' t get you. Can you iterate?,0
8,I didn ' t get you. Bottom you repeat?,0
9,Hold on for a 2d.,0
10,Hold on for a 2nd.,0
11,Confine on for a second.,0
12,"What bequeath happen, If One preclose this EMI.",0
13,"What volition bump, If I preclose this EMI.",0
14,"What will happen, If One preclose this EMI.",0
15,Bathroom you recapitulate again?,0
16,Posterior you repeat again?,0
17,Can you repeat once more?,0
18,But you evidence maine not to portion any details.,0
19,But you told me non to share any point.,0
20,Simply you told me not to share any point.,0
21,Iodin need a loan instead.,0
22,One desire a loan instead.,0
23,Ane want a loan alternatively.,0
24,This call is being recorded by celebal Bank for security reasons. Please coif not parcel your CVV and OTP with anyone.,0
25,This phone call be being recorded by celebal Savings bank for security measure reasons. Please do not share your CVV and OTP with anyone.,0
26,This call is being recorded by celebal Camber for security reasons. Delight do not portion your CVV and OTP with anyone.,0
27,I am ready to devote full requital.,0
28,Atomic number 53 am quick to give full payment.,0
29,One am ready to pay broad payment.,0
30,"No, Atomic number 53 don ' t require to pass for EMI pick.",0
31,"No, I don ' deoxythymidine monophosphate need to go for EMI option.",0
